{
  "@type": "dcat:Catalog",
  "describedBy": "https://project-open-data.cio.gov/v1.1/schema/catalog.json",
  "conformsTo": "https://project-open-data.cio.gov/v1.1/schema",
  "@context": "https://project-open-data.cio.gov/v1.1/schema/catalog.jsonld",
  "dataset": [
    {
      "identifier": "null-spatial",
      "accessLevel": "public",
      "contactPoint": {
        "hasEmail": "mailto:Alexis.Graves@ocio.usda.gov",
        "@type": "vcard:Contact",
        "fn": "Alexi Graves"
      },
      "programCode": [
        "005:059"
      ],
      "description": "Sample dataset. Spatial can be null",
      "title": "Sample Title NUll Spatial",
      "distribution": [
        {
          "@type": "dcat:Distribution",
          "downloadURL": "http://www.dm.usda.gov/foia/docs/Copy%20of%20ECM%20Congressional%20Logs%20FY14.xls",
          "mediaType": "application/vnd.ms-excel",
          "title": "Congressional Logs for Fiscal Year 2014"
        }
      ],
      "license": "https://creativecommons.org/publicdomain/zero/1.0/",
      "bureauCode": [
        "005:12"
      ],
      "modified": "2014-10-03",
      "publisher": {
        "@type": "org:Organization",
        "name": "Department of Agriculture"
      },
      "spatial": null,
      "keyword": [
        "Congressional Logs"
      ]
    }
  ]
}