{
  "@context": "https://project-open-data.cio.gov/v1.1/schema/catalog.jsonld",
  "@id": "http://www.example.gov/data.json",
  "@type": "dcat:Catalog",
  "conformsTo": "https://project-open-data.cio.gov/v1.1/schema",
  "describedBy": "https://project-open-data.cio.gov/v1.1/schema/catalog.json",
  "dataset": [
    {
      "identifier": "   ",
      "contactPoint": {
        "fn": "John Doe",
        "hasEmail": "mailto:jdoe@example.gov"
      },
      "description": "Dataset with whitespace-only identifier",
      "title": "Whitespace Identifier Dataset",
      "accessLevel": "public",
      "bureauCode": ["339:00"],
      "programCode": ["000:000"],
      "publisher": {
        "name": "Example Agency"
      },
      "keyword": ["test"]
    }
  ]
}
