{
  "@context": "https://project-open-data.cio.gov/v1.1/schema/catalog.jsonld",
  "@id": "http://www.cftc.gov/data.json",
  "@type": "dcat:Catalog",
  "conformsTo": "https://project-open-data.cio.gov/v1.1/schema",
  "describedBy": "https://project-open-data.cio.gov/v1.1/schema/catalog.json",
  "dataset": [
    {
      "contactPoint": {
        "fn": "Harold W. Hild",
        "hasEmail": "mailto:hhild@CFTC.GOV"
      },
      "describedBy": "https://www.cftc.gov/MarketReports/CommitmentsofTraders/ExplanatoryNotes/index.htm",
      "description": "COT reports provide a breakdown of each Tuesday's open interest for futures and options on futures market in which 20 or more traders hold positions equal to or above the reporting levels established by CFTC",
      "distribution": [
        {
          "accessURL": "https://www.cftc.gov/MarketReports/CommitmentsofTraders/index.htm"
        }
      ],
      "modified": "R/P1W",
      "programCode": [
        "000:000"
      ],
      "publisher": {
        "name": "U.S. Commodity Futures Trading Commission",
        "subOrganizationOf": {
          "name": "U.S. Government"
        }
      },
      "title": "Commitment of Traders",
      "accessLevel": "public",
      "bureauCode": [
        "339:00"
      ],
      "identifier": "cftc-dc1",
      "keyword": [
        "commitment of traders",
        "cot",
        "open interest"
      ],
      "spatial": "United States"
    },
    {
      "accessLevel": "public",
      "bureauCode": [
        "339:00"
      ],
      "contactPoint": {
        "fn": "Harold W. Hild",
        "hasEmail": "mailto:hhild@CFTC.GOV"
      },
      "describedBy": "https://www.cftc.gov/MarketReports/BankParticipationReports/ExplanatoryNotes/index.htm",
      "description": "The Bank Participation Report (BPR), developed by the Division of Market Oversight to provide the U.S. banking authorities and the Bank for International Settlements (BIS, located in Basel, Switzerland) aggregate large-trader positions of banks participating in various financial and non-financial commodity futures.",
      "distribution": [
        {
          "accessURL": "https://www.cftc.gov/MarketReports/BankParticipationReports/index.htm"
        }
      ],
      "identifier": "cftc-dc2",
      "keyword": [
        "bank participation report",
        "bpr",
        "banking"
      ],
      "modified": "R/P1M",
      "programCode": [
        "000:000"
      ],
      "publisher": {
        "name": "U.S. Commodity Futures Trading Commission",
        "subOrganizationOf": {
          "name": "U.S. Government"
        }
      },
      "title": "Bank Participation Reports"
    },
    {
      "accessLevel": "public",
      "bureauCode": [
        "339:00"
      ],
      "contactPoint": {
        "fn": "Harold W. Hild",
        "hasEmail": "mailto:hhild@CFTC.gov"
      },
      "describedBy": "https://www.cftc.gov/MarketReports/CottonOnCall/index.htm",
      "description": "Cotton On-Call Report shows the quantity of call cotton bought or sold on which the price has not been fixed, together with the respective futures on which the purchase or sale is based on.",
      "distribution": [
        {
          "accessURL": "https://www.cftc.gov/MarketReports/CottonOnCall/index.htm"
        }
      ],
      "identifier": "cftc-dc3",
      "keyword": [
        "cotton on call",
        "cotton on-call"
      ],
      "modified": "R/P1W",
      "programCode": [
        "000:000"
      ],
      "publisher": {
        "name": "U.S. Commodity Futures Trading Commission",
        "subOrganizationOf": {
          "name": "U.S. Government"
        }
      },
      "title": "Cotton On Call"
    },
    {
      "accessLevel": "public",
      "bureauCode": [
        "339:00"
      ],
      "contactPoint": {
        "fn": "Carrie L Coffin",
        "hasEmail": "mailto:ccoffin@CFTC.gov"
      },
      "describedBy": "https://www.cftc.gov/MarketReports/financialfcmdata/DescriptionofReportDataFields/indesx.htm",
      "description": "Futures commission merchants (FCMs) and retail foreign exchange dealers (RFEDs) must file monthly financial reports with the CFTC's Market Participants Division (MPD) within 17 business days after the end of the month. Selected financial information from these reports is published.",
      "distribution": [
        {
          "accessURL": "https://www.cftc.gov/MarketReports/financialfcmdata/index.htm"
        }
      ],
      "identifier": "cftc-dc4",
      "keyword": [
        "fcm",
        "retail foreign exchange",
        "dealer",
        "market participants",
        "mpd",
        "futures commission merchant"
      ],
      "publisher": {
        "name": "U.S. Commodity Futures Trading Commission",
        "subOrganizationOf": {
          "name": "U.S. Government"
        }
      },
      "title": "Financial Data for FCMS",
      "modified": "R/P1M",
      "programCode": [
        "000:000"
      ]
    },
    {
      "identifier": "cftc-dc5",
      "keyword": [
        "net positions",
        "larger trader net position",
        "trading account net positions"
      ],
      "accessLevel": "public",
      "bureauCode": [
        "339:00"
      ],
      "contactPoint": {
        "fn": "Byung-IL Seo",
        "hasEmail": "mailto:BSeo@CFTC.gov"
      },
      "describedBy": "https://www.cftc.gov/MarketReports/LgTraderExplanatory.html",
      "description": "The Large Trader Net Position Changes and the Trading Account Net Position Changes data provides the public with a view of the amount of trading that results in net changes to positions at the trader level and at the account level.  The data reflects trading that changes or creates an end-of-day position, as contrasted with trading that does not change a traderâ€™s end-of-day net position, such as spread or day trading.",
      "distribution": [
        {
          "accessURL": "https://www.cftc.gov/MarketReports/NetPositionChangesData/index.htm"
        }
      ],
      "modified": "2011-06-30",
      "programCode": [
        "000:000"
      ],
      "publisher": {
        "name": "U.S. Commodity Futures Trading Commission",
        "subOrganizationOf": {
          "name": "U.S. Government"
        }
      },
      "title": "Net Positions Changes Data"
    },
    {
      "accessLevel": "public",
      "bureauCode": [
        "339:00"
      ],
      "contactPoint": {
        "fn": "Richard Haynes",
        "hasEmail": "mailto:RHaynes@CFTC.gov"
      },
      "describedBy": "https://www.cftc.gov/MarketReports/SwapsReports/DataDictionary/index.htm",
      "description": "The CFTC Swaps Report aggregates a comprehensive body of swap market data that was not previously reported to regulators or regulated entities, and makes that information freely available in a form that is readily usable by both market participants and the general public. The swaps market data included in publications produced by entities such as the BIS, ISDA, and the Office of the Comptroller of the Currency vary in scope and granularity, but none corresponds directly to the data stored in the CFTC's SDRs.",
      "distribution": [
        {
          "accessURL": "https://www.cftc.gov/MarketReports/SwapsReports/index.htm"
        }
      ],
      "title": "Weekly Swaps Report",
      "identifier": "cftc-dc6",
      "keyword": [
        "swaps report",
        "swaps market"
      ],
      "modified": "R/P1W",
      "programCode": [
        "000:000"
      ],
      "publisher": {
        "name": "U.S. Commodity Futures Trading Commission",
        "subOrganizationOf": {
          "name": "U.S. Government"
        }
      }
    },
    {
      "accessLevel": "public",
      "bureauCode": [
        "339:00"
      ],
      "contactPoint": {
        "fn": "Byung-IL Seo",
        "hasEmail": "mailto:BSeo@CFTC.gov"
      },
      "publisher": {
        "name": "U.S. Commodity Futures Trading Commission",
        "subOrganizationOf": {
          "name": "U.S. Government"
        }
      },
      "title": "Cleared Margin Reports",
      "describedBy": "https://www.cftc.gov/MarketReports/ClearedMarginReports/index.htm",
      "description": "Derivatives clearing organizations (DCOs) are required to file daily reports on initial margin with the CFTC's Division of Clearing and Risk (DCR). Aggregate initial margin summary information for Chicago Mercantile Exchange (CME), ICE Clear Credit (ICC), ICE Clear US (ICUS), ICE Clear Europe (ICEU), LCH Ltd., and LCH SA is published below. The information will generally be updated within ten business days of the end of each month.",
      "distribution": [
        {
          "accessURL": "https://www.cftc.gov/MarketReports/ClearedMarginReports/index.htm"
        }
      ],
      "identifier": "cftc-dc7",
      "keyword": [
        "margin",
        "exchange"
      ],
      "modified": "R/P1M",
      "programCode": [
        "000:000"
      ]
    }
  ]
}