{
  "@context": "https://project-open-data.cio.gov/v1.1/schema/catalog.jsonld",
  "@id": "http://www.example.gov/data.json",
  "@type": "dcat:Catalog",
  "conformsTo": "https://project-open-data.cio.gov/v1.1/schema",
  "describedBy": "https://project-open-data.cio.gov/v1.1/schema/catalog.json",
  "dataset": [
    {
      "identifier": "valid-id-1",
      "contactPoint": {
        "fn": "John Doe",
        "hasEmail": "mailto:jdoe@example.gov"
      },
      "description": "Dataset with valid identifier",
      "title": "Valid Dataset One",
      "accessLevel": "public",
      "bureauCode": ["339:00"],
      "programCode": ["000:000"],
      "publisher": {
        "name": "Example Agency"
      },
      "keyword": ["test"]
    },
    {
      "contactPoint": {
        "fn": "Jane Smith",
        "hasEmail": "mailto:jsmith@example.gov"
      },
      "description": "Dataset without identifier",
      "title": "Missing ID Dataset One",
      "accessLevel": "public",
      "bureauCode": ["339:00"],
      "programCode": ["000:000"],
      "publisher": {
        "name": "Example Agency"
      },
      "keyword": ["test"]
    },
    {
      "identifier": "valid-id-2",
      "contactPoint": {
        "fn": "Bob Johnson",
        "hasEmail": "mailto:bjohnson@example.gov"
      },
      "description": "Another dataset with valid identifier",
      "title": "Valid Dataset Two",
      "accessLevel": "public",
      "bureauCode": ["339:00"],
      "programCode": ["000:000"],
      "publisher": {
        "name": "Example Agency"
      },
      "keyword": ["test"]
    },
    {
      "identifier": "valid-id-3",
      "contactPoint": {
        "fn": "Alice Williams",
        "hasEmail": "mailto:awilliams@example.gov"
      },
      "description": "Yet another dataset with valid identifier",
      "title": "Valid Dataset Three",
      "accessLevel": "public",
      "bureauCode": ["339:00"],
      "programCode": ["000:000"],
      "publisher": {
        "name": "Example Agency"
      },
      "keyword": ["test"]
    },
    {
      "contactPoint": {
        "fn": "Charlie Brown",
        "hasEmail": "mailto:cbrown@example.gov"
      },
      "description": "Another dataset without identifier",
      "title": "Missing ID Dataset Two",
      "accessLevel": "public",
      "bureauCode": ["339:00"],
      "programCode": ["000:000"],
      "publisher": {
        "name": "Example Agency"
      },
      "keyword": ["test"]
    },
    {
      "identifier": "valid-id-4",
      "contactPoint": {
        "fn": "Diana Prince",
        "hasEmail": "mailto:dprince@example.gov"
      },
      "description": "Final dataset with valid identifier",
      "title": "Valid Dataset Four",
      "accessLevel": "public",
      "bureauCode": ["339:00"],
      "programCode": ["000:000"],
      "publisher": {
        "name": "Example Agency"
      },
      "keyword": ["test"]
    },
    {
      "identifier": "valid-id-5",
      "contactPoint": {
        "fn": "Edward Norton",
        "hasEmail": "mailto:enorton@example.gov"
      },
      "description": "Last dataset with valid identifier",
      "title": "Valid Dataset Five",
      "accessLevel": "public",
      "bureauCode": ["339:00"],
      "programCode": ["000:000"],
      "publisher": {
        "name": "Example Agency"
      },
      "keyword": ["test"]
    }
  ]
}
